{
  "$schema": "./design-tokens.schema.json",
  "schemaVersion": "1.0.0",
  "brandVersion": "1.5.0",
  "description": "Autorite executable de la direction Pixel Mine cross-surface GoCharbon.",
  "tokens": {
    "primitive": {
      "color": {
        "brand": {
          "yellow": { "$type": "color", "$value": "#e7ad18", "$description": "Or mineral GoCharbon; action primaire et accent fort, volontairement moins citronne." },
          "orange": { "$type": "color", "$value": "#e2572d", "$description": "Accent secondaire et interaction." },
          "black": { "$type": "color", "$value": "#111820", "$description": "Noir ardoise froid pour le texte et les bordures du theme clair." },
          "ink": { "$type": "color", "$value": "#050b10", "$description": "Encre bleu-noir du fond principal sombre." },
          "charcoal": { "$type": "color", "$value": "#182933", "$description": "Charbon bleu profond pour les surfaces secondaires." },
          "cream": { "$type": "color", "$value": "#e7e0d2", "$description": "Creme mineral legerement grise pour les fonds clairs et le texte sombre." },
          "rock": { "$type": "color", "$value": "#0d1a22", "$description": "Roche froide bleu petrole pour les galeries et panneaux dark premium." },
          "goldDeep": { "$type": "color", "$value": "#9b6815", "$description": "Or mineral profond, reserve aux filons et recompenses." }
        },
        "transparent": { "$type": "color", "$value": "transparent", "$description": "Transparence technique partagee." }
      },
      "opacity": {
        "disabled": { "$type": "number", "$value": 0.48 },
        "muted": { "$type": "number", "$value": 0.72 },
        "overlay": { "$type": "number", "$value": 0.65 }
      },
      "space": {
        "0": { "$type": "dimension", "$value": "0px" },
        "half": { "$type": "dimension", "$value": "2px" },
        "threeQuarter": { "$type": "dimension", "$value": "3px" },
        "1": { "$type": "dimension", "$value": "4px" },
        "oneAndQuarter": { "$type": "dimension", "$value": "5px" },
        "oneAndHalf": { "$type": "dimension", "$value": "6px" },
        "oneAndThreeQuarter": { "$type": "dimension", "$value": "7px" },
        "2": { "$type": "dimension", "$value": "8px" },
        "twoAndQuarter": { "$type": "dimension", "$value": "9px" },
        "twoAndHalf": { "$type": "dimension", "$value": "10px" },
        "3": { "$type": "dimension", "$value": "12px" },
        "threeAndHalf": { "$type": "dimension", "$value": "14px" },
        "threeAndThreeQuarter": { "$type": "dimension", "$value": "15px" },
        "4": { "$type": "dimension", "$value": "16px" },
        "5": { "$type": "dimension", "$value": "20px" },
        "6": { "$type": "dimension", "$value": "24px" },
        "8": { "$type": "dimension", "$value": "32px" },
        "10": { "$type": "dimension", "$value": "40px" },
        "12": { "$type": "dimension", "$value": "48px" },
        "16": { "$type": "dimension", "$value": "64px" }
      },
      "size": {
        "touchMinimum": { "$type": "dimension", "$value": "48px", "$description": "Cible tactile minimale Flutter." },
        "iconXSmall": { "$type": "dimension", "$value": "18px" },
        "iconSmall": { "$type": "dimension", "$value": "22px" },
        "iconMedium": { "$type": "dimension", "$value": "28px" },
        "iconLarge": { "$type": "dimension", "$value": "32px" },
        "iconXLarge": { "$type": "dimension", "$value": "40px" },
        "iconHero": { "$type": "dimension", "$value": "44px" },
        "avatarSmall": { "$type": "dimension", "$value": "34px" },
        "avatarMedium": { "$type": "dimension", "$value": "46px" },
        "avatarLarge": { "$type": "dimension", "$value": "56px" },
        "mediaThumbnail": { "$type": "dimension", "$value": "80px" },
        "featurePanelMinimum": { "$type": "dimension", "$value": "140px" },
        "contentNarrow": { "$type": "dimension", "$value": "768px" },
        "contentWide": { "$type": "dimension", "$value": "1280px" }
      },
      "radius": {
        "none": { "$type": "dimension", "$value": "0px" },
        "small": { "$type": "dimension", "$value": "4px" },
        "medium": { "$type": "dimension", "$value": "8px" },
        "pill": { "$type": "dimension", "$value": "9999px" }
      },
      "border": {
        "thin": { "$type": "dimension", "$value": "1px" },
        "medium": { "$type": "dimension", "$value": "2px" },
        "strong": { "$type": "dimension", "$value": "3px" }
      },
      "font": {
        "family": {
          "display": { "$type": "fontFamily", "$value": ["Chakra Petch", "sans-serif"], "$description": "Fonte d'impact lisible pour les titres; style net et carré, cohérent Pixel Mine." },
          "body": { "$type": "fontFamily", "$value": ["Oxanium", "sans-serif"] },
          "action": { "$type": "fontFamily", "$value": ["Sanchez", "serif"], "$description": "Fonte serif distinctive reservee aux CTA et actions interactives." }
        },
        "size": {
          "caption": { "$type": "dimension", "$value": "14px" },
          "body": { "$type": "dimension", "$value": "16px" },
          "bodyLarge": { "$type": "dimension", "$value": "18px" },
          "titleSmall": { "$type": "dimension", "$value": "20px" },
          "title": { "$type": "dimension", "$value": "24px" },
          "displaySmall": { "$type": "dimension", "$value": "36px" },
          "displayLarge": { "$type": "dimension", "$value": "60px" }
        },
        "weight": {
          "regular": { "$type": "fontWeight", "$value": 400 },
          "medium": { "$type": "fontWeight", "$value": 500 },
          "bold": { "$type": "fontWeight", "$value": 700 },
          "black": { "$type": "fontWeight", "$value": 900 }
        },
        "lineHeight": {
          "tight": { "$type": "number", "$value": 1.1 },
          "body": { "$type": "number", "$value": 1.5 }
        },
        "letterSpacing": {
          "normal": { "$type": "dimension", "$value": "0px" },
          "wide": { "$type": "dimension", "$value": "0.04em" }
        }
      },
      "duration": {
        "instant": { "$type": "duration", "$value": "0ms" },
        "fast": { "$type": "duration", "$value": "150ms" },
        "standard": { "$type": "duration", "$value": "250ms" },
        "slow": { "$type": "duration", "$value": "500ms" }
      },
      "easing": {
        "linear": { "$type": "cubicBezier", "$value": [0, 0, 1, 1] },
        "standard": { "$type": "cubicBezier", "$value": [0.2, 0, 0, 1] },
        "emphasized": { "$type": "cubicBezier", "$value": [0.2, 0.8, 0.2, 1] }
      },
      "shadow": {
        "brutalSmall": { "$type": "shadow", "$value": { "x": "2px", "y": "2px", "blur": "0px", "spread": "0px", "color": "{semantic.color.shadow}" } },
        "brutalMedium": { "$type": "shadow", "$value": { "x": "5px", "y": "5px", "blur": "0px", "spread": "0px", "color": "{semantic.color.shadow}" } },
        "brutalLarge": { "$type": "shadow", "$value": { "x": "7px", "y": "7px", "blur": "0px", "spread": "0px", "color": "{semantic.color.shadow}" } }
      }
    },
    "semantic": {
      "color": {
        "background": { "$type": "color", "$modes": { "light": "{primitive.color.brand.yellow}", "dark": "{primitive.color.brand.ink}" }, "$description": "Entree jaune en light, profondeur miniere en dark." },
        "surface": { "$type": "color", "$modes": { "light": "{primitive.color.brand.cream}", "dark": "{primitive.color.brand.charcoal}" }, "$description": "Surface de lecture commune aux composants fonctionnels." },
        "surfaceStrong": { "$type": "color", "$modes": { "light": "{primitive.color.brand.yellow}", "dark": "{primitive.color.brand.rock}" }, "$description": "Surface de marque ou panneau profond a contraste renforce." },
        "mineDepth": { "$type": "color", "$modes": { "light": "{primitive.color.brand.cream}", "dark": "{primitive.color.brand.ink}" }, "$description": "Fond narratif de la mine; ne remplace jamais une surface de lecture requise." },
        "minePanel": { "$type": "color", "$modes": { "light": "{primitive.color.brand.cream}", "dark": "{primitive.color.brand.rock}" }, "$description": "Panneau fonctionnel integre a l'univers minier." },
        "mineralValue": { "$type": "color", "$value": "{primitive.color.brand.yellow}", "$description": "Action, filon, preuve, jalon ou recompense de valeur." },
        "workMaterial": { "$type": "color", "$value": "{primitive.color.brand.charcoal}", "$description": "Charbon et matiere de travail; ne porte pas seul une information." },
        "text": { "$type": "color", "$modes": { "light": "{primitive.color.brand.black}", "dark": "{primitive.color.brand.cream}" } },
        "textOnAccent": { "$type": "color", "$value": "{primitive.color.brand.black}" },
        "textMuted": { "$type": "color", "$modes": { "light": "{primitive.color.brand.charcoal}", "dark": "{primitive.color.brand.cream}" } },
        "border": { "$type": "color", "$modes": { "light": "{primitive.color.brand.black}", "dark": "{primitive.color.brand.cream}" } },
        "shadow": { "$type": "color", "$modes": { "light": "{primitive.color.brand.black}", "dark": "{primitive.color.brand.yellow}" } },
        "actionPrimary": { "$type": "color", "$value": "{primitive.color.brand.yellow}" },
        "actionSecondary": { "$type": "color", "$value": "{primitive.color.brand.orange}" },
        "actionDisabled": { "$type": "color", "$value": "{primitive.color.brand.charcoal}" },
        "link": { "$type": "color", "$modes": { "light": "{primitive.color.brand.black}", "dark": "{primitive.color.brand.orange}" } },
        "linkHover": { "$type": "color", "$modes": { "light": "{primitive.color.brand.orange}", "dark": "{primitive.color.brand.yellow}" } },
        "focus": { "$type": "color", "$value": "{primitive.color.brand.orange}" },
        "feedbackSuccess": { "$type": "color", "$value": "{primitive.color.brand.yellow}", "$description": "Toujours accompagne d'une icone ou d'un libelle." },